{
  "$schema": "http://json-schema.org/draft-07/schema#",
  "$id": "cv-schema.json",
  "title": "CV Reformatting - Esquema Canonico de Salida del Agente",
  "description": "JSON que produce el agente de transformacion (Claude) a partir del CV original. Es agnostico de formato: el microservicio de render decide, segun el template, que campos usar y en que orden. Ver conocimiento/anatomia-templates.md y templates/MAPEO-PLACEHOLDERS.md.",
  "type": "object",
  "required": ["full_name", "summary", "skills", "experience", "education", "_meta"],
  "additionalProperties": false,
  "properties": {
    "full_name": {
      "type": "string",
      "description": "Nombre completo del candidato, formato normalizado (Nombre Apellido)."
    },
    "town": {
      "type": ["string", "null"],
      "description": "Pueblo/ciudad de residencia. Se extrae siempre que el CV lo indique; solo BD Format lo renderiza (dentro de Summary of Skills). null si no aparece en el CV original -- no inventar."
    },
    "years_experience": {
      "type": ["string", "null"],
      "description": "Anios totales de experiencia profesional, como numero en string, SIN el sufijo '+' (ej. '8', no '8+') -- el template ya agrega el '+' y ' YRS. OF EXP.' de forma literal (ver templates/TAG-CONTRACT.md); duplicar el '+' en este campo produce '8++ YRS. OF EXP.' en el .docx. Calculado por el agente a partir de las fechas de experience[]; null si no se puede determinar con confianza. NOTA: no es una de las 4 reglas de contenido del PRD -- lo exige el layout del template, hay que confirmar el criterio de calculo con FITS (ver Decisiones.md)."
    },
    "summary": {
      "type": "string",
      "description": "Summary profesional en tercera persona, en ingles. Resultado de las reglas 1-3 del PRD (traduccion, tercera persona, Objectives->Summary, reescritura de summaries pobres). Es el campo evaluado por aprobacion humana (>=90%)."
    },
    "skills": {
      "type": "array",
      "items": {"type": "string"},
      "description": "Lista de habilidades/competencias. Nunca vacia salvo que el CV no tenga absolutamente ninguna base para derivarla (sin experiencia ni educacion/certificaciones). No traducir terminologia tecnica/certificaciones a menos que el original ya este en otro idioma. Si el CV original trae una lista explicita de skills/competencias, extraela tal como aparece (o normalizada minimamente) y marca `_meta.skills_source: 'explicit'`. Si el CV NO trae una lista explicita (solo un parrafo narrativo tipo 'Skills Summary', o ninguna seccion de skills), deriva la lista desde la formacion (educacion/certificaciones) y la experiencia concreta (responsabilidades/logros de experience[].bullets) -- nunca desde afirmaciones de personalidad o soft-skills genericas de un parrafo narrativo (ej. 'highly organized', 'great communication skills') -- y marca `_meta.skills_source: 'derived'`."
    },
    "experience": {
      "type": "array",
      "description": "Historial laboral, orden cronologico inverso (mas reciente primero) salvo que el original indique otro orden explicito.",
      "items": {
        "type": "object",
        "required": ["company", "title", "bullets"],
        "additionalProperties": false,
        "properties": {
          "company": {"type": "string"},
          "title": {"type": "string"},
          "location": {"type": ["string", "null"]},
          "period": {"type": ["string", "null"], "description": "Texto libre tal como conste (ej. 'Jan 2019 - Present'). null si el CV original no indica fechas para esta experiencia -- no inventar."},
          "bullets": {
            "type": "array",
            "items": {"type": "string"},
            "description": "Responsabilidades/logros, tercera persona, sin I-statements."
          }
        }
      }
    },
    "education": {
      "type": "array",
      "items": {
        "type": "object",
        "required": ["institution", "degree"],
        "additionalProperties": false,
        "properties": {
          "institution": {"type": "string"},
          "degree": {"type": "string"},
          "period": {"type": ["string", "null"]}
        }
      }
    },
    "certifications": {
      "type": "array",
      "items": {"type": "string"},
      "description": "Licencias, entrenamientos y certificaciones. Seccion separada de education en New Format/Non Template; fusionada con education en BD Format (a nivel de render, no de datos)."
    },
    "languages": {
      "type": "array",
      "items": {"type": "string"},
      "description": "Opcional. Ningun template actual tiene seccion propia de idiomas; se deja disponible para uso futuro."
    },
    "_meta": {
      "type": "object",
      "required": ["source_language", "translated", "prompt_version", "warnings", "skills_source", "skills_original"],
      "additionalProperties": false,
      "description": "No se renderiza en el .docx. Uso interno: log de Sheets (Modulo 3) y auditoria.",
      "properties": {
        "source_language": {"type": "string", "description": "Idioma detectado del CV original (codigo ISO 639-1, ej. 'es', 'en')."},
        "translated": {"type": "boolean"},
        "prompt_version": {"type": "string", "description": "Version del prompt de transformacion usada (ver 02-modulo2-agente-transformacion/prompt/)."},
        "skills_source": {
          "type": "string",
          "enum": ["explicit", "derived"],
          "description": "'explicit' si `skills` viene de una lista propia del CV original; 'derived' si se infirio desde formacion/experiencia porque el CV no traia lista explicita. Determina la severidad del chequeo de grounding sobre `skills` (ver grounding.py: explicit se bloquea si no matchea la fuente, derived solo advierte)."
        },
        "skills_original": {
          "type": "array",
          "items": {"type": "string"},
          "description": "Solo con skills_source='explicit': el texto de cada skill tal como aparece en el CV original, en su idioma original, sin traducir -- mismo orden y misma cantidad que `skills`. Con skills_source='derived', lista vacia. grounding.py verifica estos textos (no la traduccion) contra la fuente cuando el CV fue traducido."
        },
        "warnings": {
          "type": "array",
          "items": {"type": "string"},
          "description": "Codigos cerrados con formato 'CODIGO: detalle', ver catalogo completo en 02-modulo2-agente-transformacion/agente/CONTRATO-AGENTE.md. Alimenta la regla fail-closed (estados ok/review/failed, mismo documento)."
        }
      }
    }
  }
}
